module,skill,display-name,menu-code,description,action,args,phase,preceded-by,followed-by,required,output-location,outputs
SDLC Workflow,yad-discovery,Project Discovery,DI,"Optional front-zero (once per project, greenfield AND brownfield): with the analyst + pm run market research, a competitor study, a feasibility study, and (brownfield) a current-state study, then distil functional + non-functional requirements and a phased roadmap (MVP and beyond) under the reserved EP-discovery. roadmap.md becomes the menu of features each yad-epic reads. Never auto-advances.",,{idea: one-line product idea} {mode: greenfield|brownfield},0-front,,yad-review-gate,false,epics/EP-discovery/,market-research.md competitor-analysis.md current-state.md feasibility.md requirements.md roadmap.md state.json
SDLC Workflow,yad-analysis,Author Analysis,AN,"Optional front state: with the analyst pressure-test a feature idea and write the discovery brief into analysis.md. Assigns the EP-<slug> ID and seeds .sdlc state (the chain that puts analysis before epic). If skipped, the epic step does this shaping inline. Never auto-advances.",,{idea: one-line feature idea},1-front,,yad-review-gate,false,epics/EP-<slug>/,analysis.md state.json
SDLC Workflow,yad-epic,Author Epic,AE,"Front state 1: shape an idea with analyst then pm into epic.md; assign EP-<slug> ID and seed .sdlc state. Never auto-advances.",,{idea: one-line feature idea},1-front,,yad-review-gate,true,epics/EP-<slug>/,epic.md state.json
SDLC Workflow,yad-review-gate,Team Review Gate,RG,"Reusable review+approve gate for all five reviews. Shares an artifact for review, records comments and approvals as files, enforces owner + 1 reviewer (escalates on contract/auth/payments; per-repo routing for stories), advances state only when approved.",,{artifact: file under the epic} {action: open|comment|approve|advance},1-front,,,true,epics/EP-<slug>/reviews/,reviews/*.md approvals.json state.json
SDLC Workflow,yad-architecture,Author Architecture,AA,"Front state 3: with the architect author architecture.md and the locked contract.md; hash-lock the contract surface. Never auto-advances.",,{epic: EP-<slug>},1-front,yad-review-gate,yad-review-gate,true,epics/EP-<slug>/,architecture.md contract.md contract-lock.json state.json
SDLC Workflow,yad-ui,Author UI Design,AU,"Front state 5: with the ux-designer author ui-design.md and DESIGN.md, driving Impeccable slash-commands when installed. Never auto-advances.",,{epic: EP-<slug>},1-front,yad-review-gate,yad-review-gate,true,epics/EP-<slug>/,ui-design.md DESIGN.md state.json
SDLC Workflow,yad-stories,Author Stories,AS,"Front state 7: with the pm break the epic into repo-tagged stories with stable EP-<slug>-S0N IDs, one file each under stories/. Never auto-advances.",,{epic: EP-<slug>},1-front,yad-review-gate,yad-review-gate,true,epics/EP-<slug>/stories/,stories/EP-<slug>-S0N.md state.json
SDLC Workflow,yad-test-cases,Author Test Cases,TC,"Front state 9 (PARALLEL, non-blocking): opens when the stories gate passes — the epic is already ready-for-build, so the build half can start at the same time the tester works here. With the test architect (Murat) author test-cases.md covering the approved stories, and — when a testing tool is connected (.sdlc/testing.json) — generate/link the actual automation tests in it, recording test-links.json; otherwise produce the test-case artifact only. Its review never moves currentStep off ready-for-build. Never auto-advances.",,{epic: EP-<slug>},1-front,yad-review-gate,yad-review-gate,true,epics/EP-<slug>/,test-cases.md test-links.json state.json
SDLC Workflow,yad-connect-repos,Connect Code Repos,CR,"Setup/maintenance: connect code repos to the product hub so the front/brain phases are code-aware. Registers each repo (GitHub or GitLab, local-user auth, no stored tokens) in .sdlc/repos.json and caches a Repomix pack + a lightweight code-map (existing endpoints/events/data-models/modules, secret-scanned). Idempotent and refreshable; staleness tracked by HEAD sha. Run at setup or any time a new repo is added. Not a gated state — never touches epic state or approvals.",,{action: connect|refresh|list|disconnect} {repo: <name>} {path: <path-or-absolute>} {git_url: <ssh-or-https>} {domain_owner: <who>},0-setup,,yad-sync-repos,false,.sdlc/,repos.json code-context/<repo>/pack.md code-context/<repo>/code-map.md
SDLC Workflow,yad-sync-repos,Sync Connected Repos,SR,"Setup/maintenance: bring every connected repo up to date in one shot — switch each repo in .sdlc/repos.json to its default_branch and fast-forward it from origin (local-user git, no stored tokens). Working-tree only; never a gate and never writes the registry. A dirty repo is skipped and reported (never overwritten); a diverged branch is left for manual resolution (fast-forward only). After pulling, a repo's cached pack goes stale — points the human at yad repo refresh.",,{action: sync} {repo: <name>},0-setup,yad-connect-repos,yad-connect-design,false,,(none — working-tree only)
SDLC Workflow,yad-connect-design,Connect Design Tool,CD,"Setup/maintenance: connect a design tool (Figma-first, pluggable) to the product hub so the UI design step can materialize the actual feature design (mobile screens / web pages) inside it, alongside ui-design.md + DESIGN.md. Records the tool + project/file references in .sdlc/design.json (local-user / MCP-session auth, no stored tokens), detecting whether a design-tool MCP is available and degrading to markdown-only when absent. Idempotent and refreshable; one connection per project. Not a gated state — never touches epic state or approvals.",,{action: connect|refresh|list|disconnect} {tool: figma|pencil|none} {project_url: <team/project/file url>} {files: {web,mobile}},0-setup,,yad-ui,false,.sdlc/,design.json
SDLC Workflow,yad-connect-testing,Connect Testing Tool,CT,"Setup/maintenance: connect a testing tool (Playwright-first, pluggable) to the product hub so the test-cases step can implement the actual automation tests in it, alongside test-cases.md. Records the tool + project/suite references in .sdlc/testing.json (local-user / MCP-session auth, no stored tokens), detecting whether a testing-tool MCP is available and degrading to artifacts-only when absent. Idempotent and refreshable; one connection per project. Not a gated state — never touches epic state or approvals.",,{action: connect|refresh|list|disconnect} {tool: playwright|cypress|pytest|none} {project_url: <project/config reference>} {suites: {<repo>}},0-setup,,yad-test-cases,false,.sdlc/,testing.json
SDLC Workflow,yad-connect-learning,Connect Learning Tool,CL,"Setup/maintenance: connect a learning/tutoring tool (DeepTutor-first, pluggable) so the cross-cutting learning layer can tutor any team member, at any SDLC stage, in the context of what is being built. Records the tool + an optional grounded knowledge base in .sdlc/learning.json (local-user auth, no stored tokens), detecting whether the DeepTutor CLI is on PATH (a subprocess like Repomix, not an MCP) and degrading to harness-native tutoring when absent. Idempotent and refreshable; one connection per project. Not a gated state — never touches epic state or approvals.",,{action: connect|refresh|list|disconnect} {tool: deeptutor|none} {kb: <name>} {ground: true|false},0-setup,,yad-learn,false,.sdlc/,learning.json
SDLC Workflow,yad-learn,Learn (Tutor),LN,"Cross-cutting learning layer: at ANY SDLC stage a team member can ask to learn a concept and be tutored in the context of what the team is building. Routes to the connected learning tool (.sdlc/learning.json, DeepTutor-first) grounded in the project knowledge base, or degrades to harness-native tutoring (the harness model reading the artifacts). Renders a tutorial artifact and appends to a per-member learning ledger kept LOCAL-ONLY (gitignored, never committed/pushed to the hub or any code repo) so it stays a private, personal skills log (yad-status rolls up the local records). Purely opt-in — never blocks a gate, never touches epic state, approvals, or the contract lock.",,{concept: <idea>} {context: <focus>} {epic: EP-<slug>} {stage: <sdlc stage>} {member: <who>} {mode: explain|deep|quiz} {action: learn|list|complete},,,,,false,epics/EP-<slug>/,learning-records.json learning/<member>--<concept>.md
SDLC Workflow,yad-spec,Author Spec,SP,"Build-half Step A: for one ready-for-build story and one of its repos, run the heavy Spec Kit ceremony once (specify→clarify→plan→analyze→checklist→tasks) inside that code repo, writing specs/<story-id>/ in Spec Kit's layout (drives /speckit.* when installed, else hand-authors and records speckit: not-installed). References the locked contract; never re-invents the surface. Writes link.md back to the story. Never auto-advances.",,{epic: EP-<slug>} {story: EP-<slug>-S0N} {repo: <one of story.repos>},3-build,yad-review-gate,,false,demo-repos/<repo>/specs/<story-id>/,spec.md research.md data-model.md contracts/ plan.md tasks.md link.md
SDLC Workflow,yad-implement,Implement Task,IM,"Build-half Step B: with the dev lens, implement ONE atomic task from a story's tasks.md as a small diff (<=3 files) on its own branch feat/<story>-<task>-<slug> in the code repo. Diff stays inside the task's declared files (flag and STOP if it grows beyond them). Commit ends with a Task: <story>-<task> trailer; add Contract-Change: yes only when the locked contract surface is touched (routes back to the architecture gate). Never auto-advances.",,{epic: EP-<slug>} {story: EP-<slug>-S0N} {repo: <one of story.repos>} {task: T0N},3-build,yad-spec,,false,demo-repos/<repo>/,branch+commit per atomic task
SDLC Workflow,yad-checks,Check Gates,CK,"Build-half Step C: wire and run the production-safety CI gates on a code repo (and product hub) — spec-link (every change links a real story/spec via its Task trailer), contract-check (a contract-surface change without Contract-Change + an updated re-locked contract FAILS and routes back to the architecture gate), build/test/lint, verified-commits (signed + roster-known authors), and the pattern gates commit-message / pr-title / pr-template (profile-aware code|hub). CI-agnostic bash invoked by GitHub Actions and GitLab CI. Blocking in CI; the human still owns the merge. Never auto-advances.",,{repo: <one of an epic's repos | hub>} {action: wire|run} {base: target branch},3-build,yad-implement,,false,demo-repos/<repo>/,checks/*.sh .github/workflows/yad-checks.yml .gitlab-ci.yml
SDLC Workflow,yad-pr-template,PR/MR Template,PT,"Build-half Step D: detect a code repo's platform and commit the matching PR/MR template (.github/pull_request_template.md or .gitlab/merge_request_templates/Default.md) with an Impact & Risk block. A high risk level (or a touched contract/auth/payments surface) routes the review to domain owners — the same escalation yad-review-gate applies. Ships the routing helper risk-route.sh plus the pattern-gate scripts pr-title.sh and pr-template.sh (used by yad-checks). Never auto-advances.",,{repo: <one of an epic's repos | hub>} {action: wire|route} {body: PR description file},3-build,yad-checks,,false,demo-repos/<repo>/,.github/pull_request_template.md .gitlab/merge_request_templates/Default.md checks/risk-route.sh checks/pr-title.sh checks/pr-template.sh
SDLC Workflow,yad-commit,Commit by Convention,CM,"Build-half helper: commit ONE staged atomic change by the conventions — a Conventional-Commits subject, the fixed trailer block (Task -> Contract-Change -> Co-Authored-By), and the <=3-file atomic guard. The human git author owns the commit; an assisting AI is recorded only as a Co-Authored-By footer chosen per-commit with --ai (claude|copilot|cursor|coderabbit|none, default none). Drives the yad commit CLI. Never auto-advances.",,{type: feat|fix|...} {message: subject} {ai: <tool|none>} {task: <id>} {contract-change: true|false},3-build,yad-implement,,false,<repo>/,one commit
SDLC Workflow,yad-open-pr,Open PR/MR,OP,"Build-half helper: open a code-repo task PR/MR from the committed platform template — detect GitHub/GitLab, push the task branch, create the PR/MR with the body prefilled (Summary / Story-task / Impact & Risk) and the title defaulting to the commit subject. Auto-assigns from the hub roster (assignee = committer, reviewers = repo reviewers + domain-owners); high risk / contract surface routes to domain owners (risk-route.sh). Drives the yad open-pr CLI. Never merges; never auto-advances.",,{repo: <name>} {risk: low|medium|high} {contract-change: true|false},3-build,yad-commit,,false,<repo>/,one PR/MR
SDLC Workflow,yad-ship,Commit + Open PR/MR,SP2,"Build-half helper: commit AND open the task PR/MR in one step — a thin orchestration over yad-commit then yad-open-pr. Commits the staged atomic change by the conventions, then pushes the branch and opens the PR/MR from the committed template with the roster auto-assigned. The PR step runs ONLY if the commit lands (a failed commit, tripped guard, or --dry-run stops before pushing). Drives the yad ship CLI. Never merges; never auto-advances.",,{type: feat|fix|...} {message: subject} {ai: <tool|none>} {repo: <name>} {risk: low|medium|high} {contract-change: true|false},3-build,yad-pr-template,,false,<repo>/,one commit + one PR/MR
SDLC Workflow,yad-hub-bridge,Hub Review Bridge,HB,"The templated PR/MR bridge for the front-half review gate: when the product hub has a platform (.sdlc/hub.json), open a review PR/MR on the hub for an authored artifact, set required reviewers/labels from the routing rule, and provide the read-only gh/glab recipes yad-review-gate's sync uses to pull platform comments + approvals into the file ledger. Local-user auth, no stored tokens; file ledger stays the source of truth; degrades to file-only when no platform/CLI. Never auto-advances.",,{epic: EP-<slug>} {artifact: epic.md|architecture.md|ui-design.md|stories/} {action: open|route},1-front,yad-review-gate,yad-review-gate,false,epics/EP-<slug>/.sdlc/,hub-prs.json
SDLC Workflow,yad-engineer-review,Engineer Review & Merge,ER,"Build-half Step E: wire an advisory AI first-pass (CodeRabbit) on the PR, record the human engineer review with the same human_approve discipline as the front gates (owner + 1 reviewer, escalating to domain owners on high risk / contract / auth / payments), and on merge record the ship in epics/<epic>/.sdlc/build-log.json and update the story state. AI review is advisory, never the authority; the human owns the merge. Never auto-advances.",,{epic: EP-<slug>} {story: EP-<slug>-S0N} {task: T0N} {repo: <repo>} {action: ai-review|approve|ship},3-build,yad-ship,,false,epics/EP-<slug>/.sdlc/,build-log.json story-status
SDLC Workflow,yad-backfill,Backfill Specs,BF,"Build-half Step G: generate specs for already-built features in an existing repo. Confirm Repomix (npx repomix CLI), pack ONE feature (compress + git logs, secret-scan), feed to AI with a 'describe what exists, do not invent' prompt, write a DRAFT spec marked verified: false. Human approval (reuse yad-review-gate) makes it real. Boundary auto-proposed and human-confirmed. A change is blocked only until the features it touches have approved specs. Never auto-advances.",,{repo: <repo>} {feature: <name + globs>} {action: pack|draft|approve|gate},3-build,,,false,demo-repos/<repo>/specs/backfill/<feature>/,spec.md backfill-check.sh
SDLC Workflow,yad-run,Run (Automation),RN,"Phase 4 orchestrator: drive a story's back-half loop (spec→tasks→implement→checks) in one code repo, reading each step's automation dial from build-state — on machine_advance it advances on its own, on human_approve it stops for a human. Records every run in the trust log. Realizes Step B (a clean checks pass auto-advances to the engineer review when earned; any FAIL / scope overrun / contract touch HALTS). set-dial earns/reverts a step's automation (machine_advance gated by the trust threshold; front states and engineer-review refused); kill/unkill toggles the system-wide kill switch. Front states and the human merge gate never auto-advance.",,{epic: EP-<slug>} {story: EP-<slug>-S0N} {repo: <repo>} {action: run|set-dial|kill|unkill} {step: <back-step>} {to: human_approve|machine_advance},4-automate,yad-spec,yad-engineer-review,false,epics/EP-<slug>/.sdlc/,build-state/<story-id>.json trust-log.json
SDLC Workflow,yad-status,SDLC Status,SS,"Read-only: print the full front-state chain, per-step dials, contract lock, story repo tags, and pending approvals at the active gate. For stories in the build half, also print each back-half step's automation dial and status, the trust record (runs / % approved-unchanged / earned vs gathering evidence), and the system-wide kill-switch state.",,{epic: EP-<slug>},1-front,,,false,,
SDLC Workflow,yad-connect-docs,Connect Docs Target,DX,"Setup/maintenance: connect a docs/Pages publishing target so the interactive-docs steps can deploy the generated site (not just commit its source). Auto-detects the platform from .sdlc/hub.json (github->github-pages, gitlab->gitlab-pages, null->build-only), resolves the Vite base path, and records the target in .sdlc/docs.json (local-user auth, no stored tokens). Degrades to build-only when gh/glab is absent. Idempotent and refreshable; one connection per project. Not a gated state — never touches epic state or approvals.",,{action: connect|refresh|list|disconnect} {target: github-pages|gitlab-pages|none} {scope: hub|<repo>|dedicated} {base_path: <override>},0-setup,,yad-docs,false,.sdlc/,docs.json
SDLC Workflow,yad-docs,Author Docs Site,DS,"Generate the per-epic interactive documentation SPA (animated flow canvas + role-based stakeholder doc pages) from the epic's approved artifacts (epic, architecture, locked contract, ui-design, stories, code-context, test-cases), themed by the connected design system, into epics/EP-<slug>/docs-site/. Copies the vendored React/Vite/Tailwind shell verbatim and generates src/data/*.ts deterministically; drives the yad docs build/deploy CLI to publish to Pages (or build-only). An OUTPUT ENRICHMENT — never a gate; never mutates state.json, approvals, or the contract lock.",,{epic: EP-<slug>} {action: generate|refresh|deploy} {login_gate: true|false},,yad-review-gate,,false,epics/EP-<slug>/docs-site/,docs-site/ docs-build.json
SDLC Workflow,yad-docs-overview,Docs Overview Site,DO,"Generate the project SDLC-overview interactive site (docs/sdlc-site/) — every stage from setup to ship modeled as flow paths, system components, and stakeholder roles — reusing the same vendored shell, themed with yadflow's brand palette. Reads config.yaml + module-help.csv + the overview diagram as the pipeline source. Folds the hand-maintained docs/index.html report into the site as report.html (linked from the nav). Not a gate — a project-level enrichment that regenerates whenever the skill set / pipeline changes.",,{action: generate|deploy},,,,false,docs/sdlc-site/,sdlc-site/ .docs-build.json
SDLC Workflow,yad-docs-sync,Docs Sync,DY,"Maintenance/CI: keep the generated doc sites fresh. Detect staleness (a content hash of the approved artifacts + the connected repos' HEAD shas + the doc-shell version vs each site's build manifest), report which sites drifted and why, regenerate + redeploy the stale ones, and wire a CI job that rebuilds on push (carrying [skip ci] + a concurrency group to prevent deploy loops). Generalizes the rule that feature work must hand-update docs/index.html + diagrams + skill counts. Refresh is always a human/CI decision; never a gate.",,{action: check|refresh|wire} {epic: EP-<slug>},,,,false,epics/EP-<slug>/.sdlc/,docs-build.json yad-docs.yml
SDLC Workflow,yad-change,Change/Defect Intake,CH,"Phase 6 post-lock change management: the INTAKE + TRIAGE step of a feature thread. Classifies the change DEPTH (defect-fix / behavioral-no-surface / contract-surface / new-capability), seeds a NEW EP-<slug> change-epic threaded to its parent (lineage frontmatter kind/parent/thread/inherits/supersedes + a state.json whose inherited steps are pre-marked done and only the changed steps run; a pointer-lock contract-lock.json when architecture is inherited), and records the intake in change.json (escape_stage + root_cause for defects). For hotfixes it records the ship-first exception and opens reconcile-debt.json. Never auto-advances — hands off to the normal authoring skills + yad-review-gate.",,{parent: EP-<slug>} {title: one-line} {kind: change|defect|hotfix} {origin: production|staging|qa|review} {severity: sev1..sev4} {description: text} {affected: artifacts},1-front,,yad-review-gate,false,epics/EP-<slug>/,epic.md state.json change.json reconcile-debt.json contract-lock.json
SDLC Workflow,yad-timeline,Feature Timeline,TL,"Render a feature THREAD (its linked epics, genesis->changes->defects) as an evolution view (the vendored React/Vite/Tailwind shell HTML + a TIMELINE.md summary) AND resolve the inheritance chain into the authoritative current artifact set (thread-resolved.md: the winning source per artifact + the resolved contract-lock hash) — the composed source-of-truth AI/humans read for the next change. Reads frontmatter lineage + each change.json + build-log.json. An OUTPUT ENRICHMENT — never a gate; never mutates state.",,{thread: EP-<genesis>} {action: generate|deploy},,,,false,epics/EP-<genesis>/,timeline-site/ thread-resolved.md TIMELINE.md
SDLC Workflow,yad-defects,Quality-Gap Report,DF,"Generate a per-epic AND per-thread defect/bug report (same vendored shell + DEFECTS.md). Walks the thread for every kind:defect change-epic + each change.json defect block + shipped regressions in build-log.json, aggregates by escape_stage (the SDLC gate that should have caught it) and root_cause, and visualizes WHERE quality gaps systematically come from (e.g. % of thread defects that escaped at the test-cases gate) so the team can harden the originating stage. An OUTPUT ENRICHMENT — never a gate; never mutates state.",,{epic: EP-<slug> | thread: EP-<genesis>} {action: generate|deploy},,,,false,epics/EP-<slug>/,defects-site/ DEFECTS.md
SDLC Workflow,yad-reconcile,Change Reconciler,RE,"Maintenance/CI (mirrors yad-docs-sync — never a gate): detect post-lock DRIFT/ORPHANS — shipped code or a repo HEAD advance (the repos.json syncedHead-vs-current-HEAD rule) with NO owning change-epic in any thread — plus open hotfix reconcile debt, and report which thread drifted and why. refresh scaffolds a reconcile change-epic stub (hands to yad-change) — never silent; wire commits advisory CI ([skip ci] + concurrency, like yad-docs-sync). The actual merge BLOCK is the lineage-check / reconcile-debt gates; this only discovers.",,{action: check|refresh|wire} {thread: EP-<genesis>},,,,false,epics/EP-<genesis>/.sdlc/,(report) reconcile-debt.json yad-reconcile.yml
